{
  "delivery_package_id": "delivery-package-demo-0002", "schema_version": "1.0.0", "tenant_id": "tenant-demo", "project_id": "project-demo", "export_id": "delivery-export-demo-0002", "scope": "final", "source_snapshot_revision": 9,
  "source_records": [{"source_kind": "project", "source_record_id": "project-demo", "source_revision": 9, "source_sha256": "aaaaaaaaaaaaaaaaaaaaaaaaaaaaaaaaaaaaaaaaaaaaaaaaaaaaaaaaaaaaaaaa", "tenant_id": "tenant-demo", "project_id": "project-demo"}],
  "required_deliverables": [
    {"deliverable_id": "strategy", "source_record_id": "artifact-strategy-001", "source_sha256": "1111111111111111111111111111111111111111111111111111111111111111", "package_path": "strategy/topic-inventory.json", "release_status": "released"},
    {"deliverable_id": "architecture", "source_record_id": "artifact-architecture-001", "source_sha256": "2222222222222222222222222222222222222222222222222222222222222222", "package_path": "architecture/page-map.json", "release_status": "released"},
    {"deliverable_id": "design", "source_record_id": "artifact-design-001", "source_sha256": "3333333333333333333333333333333333333333333333333333333333333333", "package_path": "design/design-system.json", "release_status": "released"},
    {"deliverable_id": "keyword-research", "source_record_id": "artifact-keywords-001", "source_sha256": "4444444444444444444444444444444444444444444444444444444444444444", "package_path": "keyword-research/evidence.json", "release_status": "released"},
    {"deliverable_id": "roadmap", "source_record_id": "artifact-roadmap-001", "source_sha256": "5555555555555555555555555555555555555555555555555555555555555555", "package_path": "roadmap/plan.json", "release_status": "released"},
    {"deliverable_id": "copywriter-handoff", "source_record_id": "artifact-copywriter-001", "source_sha256": "6666666666666666666666666666666666666666666666666666666666666666", "package_path": "copywriter-handoff/briefing.json", "release_status": "released"},
    {"deliverable_id": "developer-handoff", "source_record_id": "artifact-developer-001", "source_sha256": "7777777777777777777777777777777777777777777777777777777777777777", "package_path": "developer-handoff/page-spec.json", "release_status": "released"}
  ],
  "missing_deliverables": [], "package_paths": ["README.md", "export-manifest.json", "checksums.sha256", "strategy/topic-inventory.json", "architecture/page-map.json", "design/design-system.json", "keyword-research/evidence.json", "roadmap/plan.json", "copywriter-handoff/briefing.json", "developer-handoff/page-spec.json"], "package_sha256": "8888888888888888888888888888888888888888888888888888888888888888", "zip_sha256": "9999999999999999999999999999999999999999999999999999999999999999",
  "role_packages": [{"role": "copywriter", "role_handoff_manifest_id": "role-handoff-demo-0002", "manifest_path": "copywriter-handoff/manifest.json", "manifest_sha256": "aaaaaaaaaaaaaaaaaaaaaaaaaaaaaaaaaaaaaaaaaaaaaaaaaaaaaaaaaaaaaaaa"}, {"role": "developer", "role_handoff_manifest_id": "role-handoff-demo-0003", "manifest_path": "developer-handoff/manifest.json", "manifest_sha256": "bbbbbbbbbbbbbbbbbbbbbbbbbbbbbbbbbbbbbbbbbbbbbbbbbbbbbbbbbbbbbbbb"}],
  "notion_import_manifest": {"notion_import_manifest_id": "notion-import-demo-0001", "manifest_path": "notion-import/manifest.json", "manifest_sha256": "cccccccccccccccccccccccccccccccccccccccccccccccccccccccccccccccc"}, "task_assignment_manifest_path": "notion-import/tasks.csv", "quality_summary": {"summary_path": "quality-reports/summary.json", "content_sha256": "dddddddddddddddddddddddddddddddddddddddddddddddddddddddddddddddd"}, "export_manifest_path": "export-manifest.json", "checksums_path": "checksums.sha256", "created_at": "2026-08-20T12:00:00Z", "package_revision": 2, "derived_status": "archived"
}
