{
  "delivery_package_id": "delivery-package-demo-0001", "schema_version": "1.0.0", "tenant_id": "tenant-demo", "project_id": "project-demo", "export_id": "delivery-export-demo-0001", "scope": "checkpoint", "source_snapshot_revision": 3,
  "source_records": [{"tenant_id": "tenant-demo", "project_id": "project-demo", "source_kind": "project", "source_record_id": "project-demo", "source_revision": 3, "source_sha256": "aaaaaaaaaaaaaaaaaaaaaaaaaaaaaaaaaaaaaaaaaaaaaaaaaaaaaaaaaaaaaaaa"}],
  "required_deliverables": [{"deliverable_id": "strategy", "source_record_id": "artifact-strategy-001", "source_sha256": "bbbbbbbbbbbbbbbbbbbbbbbbbbbbbbbbbbbbbbbbbbbbbbbbbbbbbbbbbbbbbbbb", "package_path": "strategy/topic-inventory.json", "release_status": "released"}],
  "missing_deliverables": ["architecture", "design", "keyword-research", "roadmap", "copywriter-handoff", "developer-handoff"], "package_paths": ["README.md", "export-manifest.json", "strategy/topic-inventory.json"], "package_sha256": "cccccccccccccccccccccccccccccccccccccccccccccccccccccccccccccccc", "zip_sha256": "dddddddddddddddddddddddddddddddddddddddddddddddddddddddddddddddd",
  "role_packages": [{"role": "project_management", "role_handoff_manifest_id": "role-handoff-demo-0001", "manifest_path": "project-management/manifest.json", "manifest_sha256": "eeeeeeeeeeeeeeeeeeeeeeeeeeeeeeeeeeeeeeeeeeeeeeeeeeeeeeeeeeeeeeee"}],
  "notion_import_manifest": {"notion_import_manifest_id": "notion-import-demo-0001", "manifest_path": "notion-import/manifest.json", "manifest_sha256": "ffffffffffffffffffffffffffffffffffffffffffffffffffffffffffffffff"}, "created_at": "2026-08-20T10:00:00Z", "package_revision": 1, "derived_status": "prepared"
}
